{
 "format": "qconform-program",
 "format_version": 0,
 "channels": [
  {
   "name": "gen0",
   "unit": {
    "num": 1,
    "den": 16773120000
   },
   "sample_unit": {
    "num": 1,
    "den": 9584640000
   }
  },
  {
   "name": "ro0",
   "unit": {
    "num": 1,
    "den": 2150400000
   }
  }
 ],
 "frames": [
  {
   "name": "gen0_frame",
   "channel": "gen0",
   "frequency": {
    "num": 0,
    "den": 1
   },
   "phase": {
    "num": 0,
    "den": 1
   }
  },
  {
   "name": "ro0_frame",
   "channel": "ro0",
   "frequency": {
    "num": 0,
    "den": 1
   },
   "phase": {
    "num": 0,
    "den": 1
   }
  }
 ],
 "waveforms": [
  {
   "name": "half_pi_w0",
   "kind": "samples",
   "full_scale": 32766,
   "i": [
    10,
    13,
    15,
    19,
    23,
    28,
    34,
    40,
    49,
    58,
    69,
    83,
    98,
    117,
    138,
    162,
    191,
    224,
    262,
    305,
    355,
    412,
    477,
    551,
    634,
    729,
    835,
    955,
    1089,
    1239,
    1405,
    1591,
    1796,
    2022,
    2272,
    2545,
    2845,
    3172,
    3528,
    3913,
    4330,
    4780,
    5263,
    5780,
    6332,
    6920,
    7543,
    8202,
    8897,
    9626,
    10388,
    11184,
    12009,
    12864,
    13745,
    14650,
    15576,
    16518,
    17474,
    18439,
    19408,
    20378,
    21343,
    22297,
    23236,
    24154,
    25046,
    25906,
    26728,
    27508,
    28239,
    28918,
    29539,
    30098,
    30591,
    31015,
    31366,
    31642,
    31840,
    31960,
    32000,
    31960,
    31840,
    31642,
    31366,
    31015,
    30591,
    30098,
    29539,
    28918,
    28239,
    27508,
    26728,
    25906,
    25046,
    24154,
    23236,
    22297,
    21343,
    20378,
    19408,
    18439,
    17474,
    16518,
    15576,
    14650,
    13745,
    12864,
    12009,
    11184,
    10388,
    9626,
    8897,
    8202,
    7543,
    6920,
    6332,
    5780,
    5263,
    4780,
    4330,
    3913,
    3528,
    3172,
    2845,
    2545,
    2272,
    2022,
    1796,
    1591,
    1405,
    1239,
    1089,
    955,
    835,
    729,
    634,
    551,
    477,
    412,
    355,
    305,
    262,
    224,
    191,
    162,
    138,
    117,
    98,
    83,
    69,
    58,
    49,
    40,
    34,
    28,
    23,
    19,
    15,
    13
   ],
   "q": [
    0,
    0,
    0,
    0,
    0,
    0,
    0,
    0,
    0,
    0,
    0,
    0,
    0,
    0,
    0,
    0,
    0,
    0,
    0,
    0,
    0,
    0,
    0,
    0,
    0,
    0,
    0,
    0,
    0,
    0,
    0,
    0,
    0,
    0,
    0,
    0,
    0,
    0,
    0,
    0,
    0,
    0,
    0,
    0,
    0,
    0,
    0,
    0,
    0,
    0,
    0,
    0,
    0,
    0,
    0,
    0,
    0,
    0,
    0,
    0,
    0,
    0,
    0,
    0,
    0,
    0,
    0,
    0,
    0,
    0,
    0,
    0,
    0,
    0,
    0,
    0,
    0,
    0,
    0,
    0,
    0,
    0,
    0,
    0,
    0,
    0,
    0,
    0,
    0,
    0,
    0,
    0,
    0,
    0,
    0,
    0,
    0,
    0,
    0,
    0,
    0,
    0,
    0,
    0,
    0,
    0,
    0,
    0,
    0,
    0,
    0,
    0,
    0,
    0,
    0,
    0,
    0,
    0,
    0,
    0,
    0,
    0,
    0,
    0,
    0,
    0,
    0,
    0,
    0,
    0,
    0,
    0,
    0,
    0,
    0,
    0,
    0,
    0,
    0,
    0,
    0,
    0,
    0,
    0,
    0,
    0,
    0,
    0,
    0,
    0,
    0,
    0,
    0,
    0,
    0,
    0,
    0,
    0,
    0,
    0
   ]
  },
  {
   "name": "pi_w0",
   "kind": "samples",
   "full_scale": 32766,
   "i": [
    10,
    13,
    15,
    19,
    23,
    28,
    34,
    40,
    49,
    58,
    69,
    83,
    98,
    117,
    138,
    162,
    191,
    224,
    262,
    305,
    355,
    412,
    477,
    551,
    634,
    729,
    835,
    955,
    1089,
    1239,
    1405,
    1591,
    1796,
    2022,
    2272,
    2545,
    2845,
    3172,
    3528,
    3913,
    4330,
    4780,
    5263,
    5780,
    6332,
    6920,
    7543,
    8202,
    8897,
    9626,
    10388,
    11184,
    12009,
    12864,
    13745,
    14650,
    15576,
    16518,
    17474,
    18439,
    19408,
    20378,
    21343,
    22297,
    23236,
    24154,
    25046,
    25906,
    26728,
    27508,
    28239,
    28918,
    29539,
    30098,
    30591,
    31015,
    31366,
    31642,
    31840,
    31960,
    32000,
    31960,
    31840,
    31642,
    31366,
    31015,
    30591,
    30098,
    29539,
    28918,
    28239,
    27508,
    26728,
    25906,
    25046,
    24154,
    23236,
    22297,
    21343,
    20378,
    19408,
    18439,
    17474,
    16518,
    15576,
    14650,
    13745,
    12864,
    12009,
    11184,
    10388,
    9626,
    8897,
    8202,
    7543,
    6920,
    6332,
    5780,
    5263,
    4780,
    4330,
    3913,
    3528,
    3172,
    2845,
    2545,
    2272,
    2022,
    1796,
    1591,
    1405,
    1239,
    1089,
    955,
    835,
    729,
    634,
    551,
    477,
    412,
    355,
    305,
    262,
    224,
    191,
    162,
    138,
    117,
    98,
    83,
    69,
    58,
    49,
    40,
    34,
    28,
    23,
    19,
    15,
    13
   ],
   "q": [
    0,
    0,
    0,
    0,
    0,
    0,
    0,
    0,
    0,
    0,
    0,
    0,
    0,
    0,
    0,
    0,
    0,
    0,
    0,
    0,
    0,
    0,
    0,
    0,
    0,
    0,
    0,
    0,
    0,
    0,
    0,
    0,
    0,
    0,
    0,
    0,
    0,
    0,
    0,
    0,
    0,
    0,
    0,
    0,
    0,
    0,
    0,
    0,
    0,
    0,
    0,
    0,
    0,
    0,
    0,
    0,
    0,
    0,
    0,
    0,
    0,
    0,
    0,
    0,
    0,
    0,
    0,
    0,
    0,
    0,
    0,
    0,
    0,
    0,
    0,
    0,
    0,
    0,
    0,
    0,
    0,
    0,
    0,
    0,
    0,
    0,
    0,
    0,
    0,
    0,
    0,
    0,
    0,
    0,
    0,
    0,
    0,
    0,
    0,
    0,
    0,
    0,
    0,
    0,
    0,
    0,
    0,
    0,
    0,
    0,
    0,
    0,
    0,
    0,
    0,
    0,
    0,
    0,
    0,
    0,
    0,
    0,
    0,
    0,
    0,
    0,
    0,
    0,
    0,
    0,
    0,
    0,
    0,
    0,
    0,
    0,
    0,
    0,
    0,
    0,
    0,
    0,
    0,
    0,
    0,
    0,
    0,
    0,
    0,
    0,
    0,
    0,
    0,
    0,
    0,
    0,
    0,
    0,
    0,
    0
   ]
  },
  {
   "name": "readout_w0",
   "kind": "const",
   "amplitude": {
    "num": 9829,
    "den": 32766
   }
  }
 ],
 "elements": [
  {
   "kind": "set_frequency",
   "frame": "ro0_frame",
   "frequency": {
    "num": -19411763203125,
    "den": 16384
   },
   "id": 0
  },
  {
   "kind": "delay",
   "frame": "gen0_frame",
   "duration": 17628,
   "id": 1
  },
  {
   "kind": "set_frequency",
   "frame": "gen0_frame",
   "frequency": {
    "num": -38376570886875,
    "den": 8192
   },
   "id": 2
  },
  {
   "kind": "play",
   "frame": "gen0_frame",
   "waveform": "half_pi_w0",
   "duration": 280,
   "id": 3
  },
  {
   "kind": "delay",
   "frame": "gen0_frame",
   "duration": 3347,
   "id": 4
  },
  {
   "kind": "shift_phase",
   "frame": "gen0_frame",
   "phase": {
    "num": 1,
    "den": 4
   },
   "id": 5
  },
  {
   "kind": "play",
   "frame": "gen0_frame",
   "waveform": "pi_w0",
   "duration": 280,
   "id": 6
  },
  {
   "kind": "delay",
   "frame": "gen0_frame",
   "duration": 3347,
   "id": 7
  },
  {
   "kind": "set_frequency",
   "frame": "gen0_frame",
   "frequency": {
    "num": -57092341775625,
    "den": 16384
   },
   "id": 8
  },
  {
   "kind": "shift_phase",
   "frame": "gen0_frame",
   "phase": {
    "num": 3,
    "den": 4
   },
   "id": 9
  },
  {
   "kind": "play",
   "frame": "gen0_frame",
   "waveform": "readout_w0",
   "duration": 10052,
   "id": 10
  },
  {
   "kind": "delay",
   "frame": "ro0_frame",
   "duration": 3300,
   "id": 11
  },
  {
   "kind": "capture",
   "frame": "ro0_frame",
   "duration": 2149,
   "id": 12
  }
 ]
}
